{
  "forensic_event_id": "f1f1f1f1-f1f1-4ff1-8ff1-f1f1f1f1f1f1",
  "correlation_id": "66666666-6666-4666-8666-666666666666",
  "request_id": "55555555-5555-4555-8555-555555555555",
  "event_type": "review_package_prepared",
  "route_decision_id": "77777777-7777-4777-8777-777777777773",
  "execution_plan_id": "99999999-9999-4999-8999-999999999999",
  "stable_plan_hash": "a8f7e75a4a4ea309803cf16fec43a4adb788ddcaa5589d91a9c00a41a8f56df7",
  "review_package_id": "abababab-abab-4bab-8bab-abababababab",
  "timestamp_utc": "2030-01-01T00:09:30Z",
  "current_posture": "explicit_operator_approval",
  "execution_state": "waiting_explicit_approval",
  "degraded_subtype": null,
  "summary": "bounded review handoff prepared for explicit operator approval",
  "redaction_level": "sensitive_fields_redacted",
  "payload_minimized": true
}
