{
  "forensic_event_id": "f0f0f0f0-f0f0-4ff0-8ff0-f0f0f0f0f0f0",
  "correlation_id": "66666666-6666-4666-8666-666666666666",
  "request_id": "55555555-5555-4555-8555-555555555555",
  "event_type": "denial_issued",
  "route_decision_id": null,
  "execution_plan_id": null,
  "stable_plan_hash": null,
  "review_package_id": null,
  "timestamp_utc": "2030-01-01T00:08:30Z",
  "current_posture": "denied",
  "execution_state": "denied",
  "degraded_subtype": null,
  "summary": "request denied due to missing trust basis",
  "redaction_level": "none",
  "payload_minimized": true
}
